{
  "setting": "community",
  "respiratory_tb": "yes",
  "pretreatment_burden": "high",
  "smear": "3+",
  "cough": "frequent",
  "cavitation": "yes",
  "gxp_mtb": "detected",
  "rifampin": "susceptible",
  "other_resistance": "unknown",
  "resistance_suspected": "no",
  "on_treatment": "yes",
  "regimen_appropriate": "yes",
  "effectiveness_assessed": "yes",
  "adherence_verified": "yes",
  "tolerance_adequate": "yes",
  "uninterrupted_effective_days": 5,
  "days_since_isolation_started": 5,
  "clinical_response": "improving",
  "micro_response": "improving",
  "community_risk": "high",
  "vulnerable_contacts": "yes",
  "congregate_return": "no",
  "targeted_restrictions_feasible": "yes",
  "patient_harm": "moderate",
  "financial_harm": "moderate"
}
